{
  "type": "method",
  "version": 1,
  "id": "b6b8f3a1-2c4d-4e5f-8a9b-0c1d2e3f4a5b",
  "created": "2026-06-01T10:00:00.000-07:00",
  "updated": "2026-06-01T10:00:00.000-07:00",
  "name": "Joint",
  "shortName": "joint",
  "aliases": [
    "j",
    "jay",
    "doobie"
  ],
  "defaultGrams": 0.35,
  "ext": {
    "pufftab": {
      "icon": "flame.fill",
      "quickAccess": true,
      "sortOrder": 0
    }
  },
  "notes": ""
}
